{
  "design": {
    "finiteDifferenceStepUnit": 0.06,
    "invasionFraction": 0.1,
    "invasionScore": "final tagged-mutant frequency minus initial tagged-mutant frequency",
    "mutantIntroduction": "rule-blind sample of residents reassigned to the declared mutant rule at shock_step; tagged lineage inherited by descendants",
    "postIntroductionMutation": "disabled to preserve tagged mutant identity",
    "primaryCriteria": {
      "invasionGradientIdentifiable": "nonzero gradient in >= 3/4 of seeds",
      "scarcityAlignsWithInvasionGradient": "median cosine >= 0.10",
      "scarcityExceedsNeutralAlignment": "median paired scarcity-minus-neutral cosine >= +0.10",
      "scarcityPositiveInTwoThirds": ">= 2/3 scarcity motion vectors have positive alignment"
    },
    "residentContext": "actual mixed pre-shock population generated by the matched seed-specific burn-in",
    "ruleDimensions": [
      "forage_weight",
      "hazard_avoidance",
      "exploration",
      "reproduction_threshold"
    ],
    "seedCount": 12,
    "seeds": [
      14003,
      14011,
      14029,
      14041,
      14057,
      14071,
      14087,
      14101,
      14119,
      14137,
      14153,
      14173
    ]
  },
  "experimentId": "RUL-024",
  "interpretationBoundary": "This is an engineered frequency-dependent invasion proxy in a simulated ecology. It does not establish biological fitness, adaptation, or a universal selection gradient. A tagged-mutant frequency change can reflect ecological interactions, finite-population drift, and demographic effects.",
  "observerId": "OBSERVER-ALIFE-INVASION-GRADIENT",
  "primaryTest": {
    "criteria": {
      "invasionGradientIdentifiable": false,
      "scarcityAlignsWithInvasionGradient": false,
      "scarcityExceedsNeutralAlignment": false,
      "scarcityPositiveInTwoThirds": false
    },
    "criteriaPassed": 0,
    "criteriaTotal": 4,
    "pilotSupported": false
  },
  "probes": [
    {
      "actualStepUnit": 0.06,
      "centerUnit": 0.5355922213221894,
      "dimension": "forage_weight",
      "extinct": false,
      "finalMutantFraction": 0.25,
      "finalPopulation": 4,
      "initialMutantFraction": 0.10909090909090909,
      "invasionFrequencyChange": 0.14090909090909093,
      "mutantUnit": 0.4755922213221894,
      "seed": 14003,
      "sign": -1
    },
    {
      "actualStepUnit": 0.05999999999999994,
      "centerUnit": 0.5355922213221894,
      "dimension": "forage_weight",
      "extinct": false,
      "finalMutantFraction": 0.0,
      "finalPopulation": 2,
      "initialMutantFraction": 0.10909090909090909,
      "invasionFrequencyChange": -0.10909090909090909,
      "mutantUnit": 0.5955922213221894,
      "seed": 14003,
      "sign": 1
    },
    {
      "actualStepUnit": 0.06,
      "centerUnit": 0.42033309814839226,
      "dimension": "hazard_avoidance",
      "extinct": false,
      "finalMutantFraction": 0.0,
      "finalPopulation": 2,
      "initialMutantFraction": 0.10909090909090909,
      "invasionFrequencyChange": -0.10909090909090909,
      "mutantUnit": 0.36033309814839226,
      "seed": 14003,
      "sign": -1
    },
    {
      "actualStepUnit": 0.06,
      "centerUnit": 0.42033309814839226,
      "dimension": "hazard_avoidance",
      "extinct": false,
      "finalMutantFraction": 0.0,
      "finalPopulation": 3,
      "initialMutantFraction": 0.10909090909090909,
      "invasionFrequencyChange": -0.10909090909090909,
      "mutantUnit": 0.48033309814839226,
      "seed": 14003,
      "sign": 1
    },
    {
      "actualStepUnit": 0.06,
      "centerUnit": 0.3889836135776569,
      "dimension": "exploration",
      "extinct": false,
      "finalMutantFraction": 0.5,
      "finalPopulation": 4,
      "initialMutantFraction": 0.10909090909090909,
      "invasionFrequencyChange": 0.39090909090909093,
      "mutantUnit": 0.3289836135776569,
      "seed": 14003,
      "sign": -1
    },
    {
      "actualStepUnit": 0.06,
      "centerUnit": 0.3889836135776569,
      "dimension": "exploration",
      "extinct": false,
      "finalMutantFraction": 0.3333333333333333,
      "finalPopulation": 3,
      "initialMutantFraction": 0.10909090909090909,
      "invasionFrequencyChange": 0.22424242424242424,
      "mutantUnit": 0.44898361357765687,
      "seed": 14003,
      "sign": 1
    },
    {
      "actualStepUnit": 0.06,
      "centerUnit": 0.39996272352252843,
      "dimension": "reproduction_threshold",
      "extinct": false,
      "finalMutantFraction": 0.0,
      "finalPopulation": 3,
      "initialMutantFraction": 0.10909090909090909,
      "invasionFrequencyChange": -0.10909090909090909,
      "mutantUnit": 0.33996272352252843,
      "seed": 14003,
      "sign": -1
    },
    {
      "actualStepUnit": 0.06,
      "centerUnit": 0.39996272352252843,
      "dimension": "reproduction_threshold",
      "extinct": false,
      "finalMutantFraction": 0.0,
      "finalPopulation": 3,
      "initialMutantFraction": 0.10909090909090909,
      "invasionFrequencyChange": -0.10909090909090909,
      "mutantUnit": 0.4599627235225284,
      "seed": 14003,
      "sign": 1
    },
    {
      "actualStepUnit": 0.06,
      "centerUnit": 0.5232337761294286,
      "dimension": "forage_weight",
      "extinct": false,
      "finalMutantFraction": 0.0,
      "finalPopulation": 5,
      "initialMutantFraction": 0.09259259259259259,
      "invasionFrequencyChange": -0.09259259259259259,
      "mutantUnit": 0.46323377612942856,
      "seed": 14011,
      "sign": -1
    },
    {
      "actualStepUnit": 0.06000000000000005,
      "centerUnit": 0.5232337761294286,
      "dimension": "forage_weight",
      "extinct": false,
      "finalMutantFraction": 0.0,
      "finalPopulation": 5,
      "initialMutantFraction": 0.09259259259259259,
      "invasionFrequencyChange": -0.09259259259259259,
      "mutantUnit": 0.5832337761294286,
      "seed": 14011,
      "sign": 1
    },
    {
      "actualStepUnit": 0.06,
      "centerUnit": 0.4256625554000795,
      "dimension": "hazard_avoidance",
      "extinct": false,
      "finalMutantFraction": 0.0,
      "finalPopulation": 4,
      "initialMutantFraction": 0.09259259259259259,
      "invasionFrequencyChange": -0.09259259259259259,
      "mutantUnit": 0.3656625554000795,
      "seed": 14011,
      "sign": -1
    },
    {
      "actualStepUnit": 0.06,
      "centerUnit": 0.4256625554000795,
      "dimension": "hazard_avoidance",
      "extinct": false,
      "finalMutantFraction": 0.0,
      "finalPopulation": 5,
      "initialMutantFraction": 0.09259259259259259,
      "invasionFrequencyChange": -0.09259259259259259,
      "mutantUnit": 0.4856625554000795,
      "seed": 14011,
      "sign": 1
    },
    {
      "actualStepUnit": 0.06,
      "centerUnit": 0.41893521112035675,
      "dimension": "exploration",
      "extinct": false,
      "finalMutantFraction": 0.0,
      "finalPopulation": 5,
      "initialMutantFraction": 0.09259259259259259,
      "invasionFrequencyChange": -0.09259259259259259,
      "mutantUnit": 0.35893521112035676,
      "seed": 14011,
      "sign": -1
    },
    {
      "actualStepUnit": 0.06,
      "centerUnit": 0.41893521112035675,
      "dimension": "exploration",
      "extinct": false,
      "finalMutantFraction": 0.0,
      "finalPopulation": 4,
      "initialMutantFraction": 0.09259259259259259,
      "invasionFrequencyChange": -0.09259259259259259,
      "mutantUnit": 0.47893521112035675,
      "seed": 14011,
      "sign": 1
    },
    {
      "actualStepUnit": 0.06,
      "centerUnit": 0.4478831851056755,
      "dimension": "reproduction_threshold",
      "extinct": false,
      "finalMutantFraction": 0.0,
      "finalPopulation": 5,
      "initialMutantFraction": 0.09259259259259259,
      "invasionFrequencyChange": -0.09259259259259259,
      "mutantUnit": 0.3878831851056755,
      "seed": 14011,
      "sign": -1
    },
    {
      "actualStepUnit": 0.06000000000000005,
      "centerUnit": 0.4478831851056755,
      "dimension": "reproduction_threshold",
      "extinct": false,
      "finalMutantFraction": 0.0,
      "finalPopulation": 5,
      "initialMutantFraction": 0.09259259259259259,
      "invasionFrequencyChange": -0.09259259259259259,
      "mutantUnit": 0.5078831851056755,
      "seed": 14011,
      "sign": 1
    },
    {
      "actualStepUnit": 0.06,
      "centerUnit": 0.5306919169457908,
      "dimension": "forage_weight",
      "extinct": false,
      "finalMutantFraction": 0.0,
      "finalPopulation": 4,
      "initialMutantFraction": 0.09836065573770492,
      "invasionFrequencyChange": -0.09836065573770492,
      "mutantUnit": 0.47069191694579077,
      "seed": 14029,
      "sign": -1
    },
    {
      "actualStepUnit": 0.05999999999999994,
      "centerUnit": 0.5306919169457908,
      "dimension": "forage_weight",
      "extinct": false,
      "finalMutantFraction": 0.2,
      "finalPopulation": 5,
      "initialMutantFraction": 0.09836065573770492,
      "invasionFrequencyChange": 0.1016393442622951,
      "mutantUnit": 0.5906919169457907,
      "seed": 14029,
      "sign": 1
    },
    {
      "actualStepUnit": 0.06,
      "centerUnit": 0.39974442119091924,
      "dimension": "hazard_avoidance",
      "extinct": false,
      "finalMutantFraction": 0.2,
      "finalPopulation": 5,
      "initialMutantFraction": 0.09836065573770492,
      "invasionFrequencyChange": 0.1016393442622951,
      "mutantUnit": 0.33974442119091924,
      "seed": 14029,
      "sign": -1
    },
    {
      "actualStepUnit": 0.06,
      "centerUnit": 0.39974442119091924,
      "dimension": "hazard_avoidance",
      "extinct": false,
      "finalMutantFraction": 0.0,
      "finalPopulation": 5,
      "initialMutantFraction": 0.09836065573770492,
      "invasionFrequencyChange": -0.09836065573770492,
      "mutantUnit": 0.45974442119091924,
      "seed": 14029,
      "sign": 1
    },
    {
      "actualStepUnit": 0.06,
      "centerUnit": 0.3991992480265826,
      "dimension": "exploration",